{
  "format": "food-help",
  "schema_version": 1,
  "dataset_id": "774da8bd-b838-4d83-aa3b-a7ae98c7725c",
  "content_language": "en",
  "taxonomy_version": 1,
  "organizations": [
    {
      "id": "martha-s-table",
      "name": "Martha’s Table"
    },
    {
      "id": "st-vincent-de-paul-society-of-kingston",
      "name": "St. Vincent de Paul Society of Kingston"
    },
    {
      "id": "partners-in-mission-food-bank",
      "name": "Partners in Mission Food Bank"
    },
    {
      "id": "st-mary-s-cathedral",
      "name": "St. Mary’s Cathedral"
    },
    {
      "id": "outreach-st-george-s-kingston",
      "name": "Outreach St. George’s Kingston"
    },
    {
      "id": "the-salvation-army-kingston-citadel",
      "name": "The Salvation Army — Kingston Citadel"
    },
    {
      "id": "kingston-alliance-church",
      "name": "Kingston Alliance Church"
    },
    {
      "id": "lionhearts",
      "name": "Lionhearts",
      "description": "Operator of Fresh Food Market Pop-Ups in Kingston and area.",
      "url": "https://www.lionhearts.ca/kingston/our-programs/fresh-food-market-pop-ups/"
    },
    {
      "id": "trellis-hiv-community-care",
      "name": "Trellis HIV & Community Care",
      "description": "Formerly HARS.",
      "url": "https://www.trellishiv.ca/"
    }
  ],
  "resources": [
    {
      "id": "marthas-table",
      "organization_id": "martha-s-table",
      "name": "Martha’s Table",
      "summary": "Free breakfast, lunch and dinner on weekdays, takeout lunch every day, and weekday meal delivery by application.",
      "categories": [
        "prepared_meals",
        "food_delivery"
      ],
      "food_access_purpose": "Free breakfast, lunch and dinner on weekdays, takeout lunch every day, and weekday meal delivery by application.",
      "location": {
        "description": "629 Princess Street, Kingston, ON K7L 1E2",
        "address": {
          "street": "629 Princess Street",
          "locality": "Kingston",
          "region": "ON",
          "country": "CA",
          "postal_code": "K7L 1E2",
          "neighbourhood": "Princess & Nelson"
        },
        "coordinates": {
          "latitude": 44.237109,
          "longitude": -76.5015428
        }
      },
      "phone": "+16135460320",
      "official_url": "https://marthastable.ca/plan-your-visit/",
      "time_zone": "America/Toronto",
      "access": {
        "walk_in": "yes",
        "appointment_required": "no",
        "registration_required": "no",
        "identification_required": "no",
        "details": [
          "Drop in during meal times. No documents required."
        ]
      },
      "eligibility": [
        "Everyone is welcome for meals."
      ],
      "limitations": [
        "Weekend service is takeout lunch only.",
        "Meal delivery requires an application."
      ],
      "before_you_go": [
        "Takeout meals are available noon–2 p.m. every day, at the rear of the building.",
        "Door-to-door meal delivery runs Monday to Friday around midday; an application is required. Call 343-580-1519 to ask about delivery."
      ],
      "cost": {
        "state": "free",
        "description": "Free meals."
      },
      "schedule": {
        "kind": "weekly",
        "confirmed": true,
        "note": "Weekdays: breakfast 9–11, lunch noon–2, dinner 3–5. Weekend lunch: takeout only.",
        "weekly": [
          {
            "day": 1,
            "state": "published",
            "intervals": [
              {
                "opens": "09:00",
                "closes": "11:00"
              },
              {
                "opens": "12:00",
                "closes": "14:00"
              },
              {
                "opens": "15:00",
                "closes": "17:00"
              }
            ]
          },
          {
            "day": 2,
            "state": "published",
            "intervals": [
              {
                "opens": "09:00",
                "closes": "11:00"
              },
              {
                "opens": "12:00",
                "closes": "14:00"
              },
              {
                "opens": "15:00",
                "closes": "17:00"
              }
            ]
          },
          {
            "day": 3,
            "state": "published",
            "intervals": [
              {
                "opens": "09:00",
                "closes": "11:00"
              },
              {
                "opens": "12:00",
                "closes": "14:00"
              },
              {
                "opens": "15:00",
                "closes": "17:00"
              }
            ]
          },
          {
            "day": 4,
            "state": "published",
            "intervals": [
              {
                "opens": "09:00",
                "closes": "11:00"
              },
              {
                "opens": "12:00",
                "closes": "14:00"
              },
              {
                "opens": "15:00",
                "closes": "17:00"
              }
            ]
          },
          {
            "day": 5,
            "state": "published",
            "intervals": [
              {
                "opens": "09:00",
                "closes": "11:00"
              },
              {
                "opens": "12:00",
                "closes": "14:00"
              },
              {
                "opens": "15:00",
                "closes": "17:00"
              }
            ]
          },
          {
            "day": 6,
            "state": "published",
            "intervals": [
              {
                "opens": "12:00",
                "closes": "14:00"
              }
            ]
          },
          {
            "day": 7,
            "state": "published",
            "intervals": [
              {
                "opens": "12:00",
                "closes": "14:00"
              }
            ]
          }
        ],
        "exceptions": [
          {
            "date": "2026-09-07",
            "confirmed": true,
            "intervals": [],
            "note": "Closed for Labour Day, according to the provider.",
            "evidence_ids": [
              "source-1"
            ]
          },
          {
            "date": "2026-10-12",
            "confirmed": true,
            "intervals": [],
            "note": "Closed for Thanksgiving, according to the provider.",
            "evidence_ids": [
              "source-1"
            ]
          },
          {
            "date": "2026-12-23",
            "confirmed": true,
            "intervals": [
              {
                "opens": "13:00",
                "closes": "16:00"
              }
            ],
            "note": "Holiday meal: dine-in 1–4 p.m.; takeout 1–2 p.m. only.",
            "evidence_ids": [
              "source-1"
            ]
          },
          {
            "date": "2026-12-24",
            "confirmed": true,
            "intervals": [
              {
                "opens": "09:00",
                "closes": "12:00"
              }
            ],
            "note": "Holiday brunch, dine-in only.",
            "evidence_ids": [
              "source-1"
            ]
          },
          {
            "date": "2026-12-25",
            "confirmed": true,
            "intervals": [],
            "note": "Closed for Christmas Day.",
            "evidence_ids": [
              "source-1"
            ]
          },
          {
            "date": "2026-12-26",
            "confirmed": true,
            "intervals": [],
            "note": "Closed for Boxing Day.",
            "evidence_ids": [
              "source-1"
            ]
          }
        ],
        "evidence_ids": [
          "source-1"
        ]
      },
      "evidence": [
        {
          "id": "source-1",
          "source_kind": "provider",
          "url": "https://marthastable.ca/plan-your-visit/",
          "checked_on": "2026-09-04",
          "note": "Meal windows, weekend takeout, holiday closures and delivery contact.",
          "supports": [
            "name",
            "summary",
            "food_access_purpose",
            "official_url",
            "eligibility",
            "limitations",
            "before_you_go",
            "schedule"
          ]
        },
        {
          "id": "source-2",
          "source_kind": "referral_directory",
          "url": "https://211ontario.ca/service/68954791/marthas-table-marthas-table/",
          "checked_on": "2026-09-04",
          "note": "No fee or documents; drop-in access. Map link supplies provider coordinates. Provider page supersedes 211’s incomplete weekend hours.",
          "supports": [
            "name",
            "location",
            "phone",
            "cost",
            "access.walk_in",
            "access.appointment_required",
            "access.registration_required",
            "access.identification_required"
          ]
        },
        {
          "id": "provider-email-2026-09-28",
          "source_kind": "direct_confirmation",
          "checked_on": "2026-09-29",
          "note": "Martha’s Table leadership told Jamie Whelan by email on September 28, 2026 that takeout meals are offered noon–2 p.m. seven days a week and that door-to-door delivery (application required) runs Monday to Friday at mid-day. Private correspondence is kept outside this repository.",
          "supports": [
            "summary",
            "food_access_purpose",
            "categories",
            "limitations",
            "before_you_go"
          ]
        },
        {
          "id": "city-food-supports",
          "source_kind": "local_authority",
          "url": "https://www.cityofkingston.ca/community-supports/community-supports-and-well-being/food-supports/",
          "checked_on": "2026-09-29",